,Teks,label
238,dptkan e tiket promo terbang domestic internasional booking online jam info hub,1
239,gebyar poin plus plus indosat edisi priode ke no pin undi dhi resmi raih hadiah utk info,1
240,gebyar telkomselpoin no trpilih menang pin fg silah verifikasi pin situs resmi selpoinhadiahjimdocom,1
241,gratis menit nelpon sama indosat sms sama indosat mb internet slma jam tiap isi ulang rbisiulang pulsa rb nikmat gratis,1
242,gratis sms sesame indosat lama hari dengna kirim sms lama juni bonus x beri maks xjam info us,1
243,gratis internetan mb laku utk hari dg isi ulang axismu hari rp ayo isi ulang sekarang nikmat bonus info,1
244,gratis internetan hg mb nelpon menit sms sama indosat dg isiulang mulai rbutk daftar ketik gratis kirim gratis lalu isi ulang,1
245,gratis pulsa hingga rb lama hari malam cuma dg isi ulang mulai rb daftar segera ketik gratis krm kereg ckp kaliinfo ketik info krm,1
246,gt shop disc bb z jt bb torch jt bb davis jt minat galaxy s jt cp pinab gili sms versi demo http,1
247,guntur hubung facebookhttpfbcomllnzhplcmrug balas stop unruk henti terima sms facebook,1
248,hi trims kmu udh gabung layan bung gita bicara boladpt info tarik n prediksi akurat dr bung gita infomg rbsmsstop unreg gita cs,1
249,hquarters business residence lokasi emas asia afrika bdg hrg prelaunchprofit roi thn bs libur byr th tsm des jan,1
250,indomarcocell tawar jdi agenpulsa mkios chip semua oprator harga v v v cara gabung ketikdaftar kirim lukis rasa ku kita,1
251,indosatpoin plus plus selamat simcard xxxx resmi pilih m dpt hadiah pin bch sahkan ptindosat info klik,1
252,indovison promo rbu nikmat bln langgan gratis biaya pasangbonus cema bln hub pin bb fc,1
253,info ptm kios hsil undi berkat isi pulsa selamat nohp xxxxx m dpt hadiah pin menang ad info klik isiulang pulsawebscom,1
254,info resmi selamat pilih sbgi menang semarak undi ptindofood indonesia no pin dhi info pin hadiah klik undianpopmiewebscom,1
255,info resmi bpkibu hormat selamat no menang dari pesta isi ulang care no per undi tadi malam pkl sctv uinfo hadiah klik,1
256,info resmi kepadabpkibu hormat selamat no menang dari pesta isi ulang care no per undi tadi malam pkl sctv uinfo hadiah klik,1
257,info resmi ptindofood noanda t dftr menang undi pop mie edisi mndptkn unit nissan juke pinach infokunjungi,1
258,info resmi ptindofood slmt noanda tdftar pmnang pop mie raih hadiah unit nissan juke dgn pinxbv uinfo kunjung,1
259,info resmi pttri care pin menang jf m dptkan hadiah i unit toyota yaris uinfo cek pin klik,1
260,info resmi pttri care pin menang jf simcard resmi dapat hadiah unit toyota yaris no,1
261,info resmi pttri simcard resmi m dptkan hadiah mobil mazda kode pin emlb info hub klik,1
262,info resmi selamat no simcard men dptkn uang tunai rp jt dr ptindosat pintblvg info hub au klik infojimdocom,1
263,info resmi tri care selamat nomor pilih dapat hadiah unit mobil dri tri care pin menang brh info caretk,1
264,info resmi ptindofood selamat m dpt mobil nissan juke kejut pop mie pinfcd hubung drshnaldisuparman,1
265,info dana tunai jamin juta bunga syarat milik kartu kredit proses hari kerja call firli,1
266,info pinjam agun jt standart chartered bank syarat copy ktp copy kartu kredit resmi minat hub akbar trimksh,1
267,infojk mau jual rmhtanahmobilprodukjasa promosi sj dg sms massal biasa hny rp sebar no hpjam hub jogja,1
268,tahu angka jitu yg keluar putar hari hubung mbah togel semarang jamin tembus raja shio buka jam,1
269,bpk pnjam hp orng tlng bliin bpk pls rb krm nomr brunya bpk bpk ada msalh kantor polisi jgn tlpsms nnti bpk yg tlp penting,1
270,bpk belikan dulu pulsa ribu no baru bpk karna ada masalah kantor polisi jangan dulu tlpsms bpk yg tlp penting,1
271,no rekening brianasri narti norek,1
272,nomor baru papa kirimin pulsa nomor baru papa papa di kantor polisi masalah jangan telepon papa,1
273,nomor rekening bri an andika septiana,1
274,rekening bank brinorekanir mayani,1
275,rekening bank mandiri norek an murtiani,1
276,rekening bri rek anrasto murdoyo,1
277,rekening mandiri an reza prasetya,1
278,rekening bank mandiri an ali syamsudin rek,1
279,rekening bank bni norek anwahyudi alamsyah sms klo kirim,1
280,isi pulsa lebih untung myvplus dpt pulsa kamu lsg dpt voucher diskon dpt hadiah juga dpt point yuk klik httpbitlymyvplus,1
281,isi ulang pulsa rp regular hd com sukses refgratis pulsa sd rb hg hr mlmktkgratis krm,1
282,isi ulang pulsa rp regular putera sukses refgratis pulsa sd rb hg hr mlmktkgratis krm,1
283,anda butuh angka jitu gaib d d d sgp jamin tembus silah sms mastertogel,1
284,kak kirim dulu pulsarb no baru,1
285,dr ktr indosat sdh hub nmr tp tdk trsambungjd krm sms bhw no mendpt mobil jaguar pindhi info plusplusweeblycom,1
286,sdh mnghubungi tdk trsambung sim card dapat hadiah tiga dri ptaxis pin klik ptaxisblogspotcoid,1
287,kejut poin hadian rp jt resmi beri milik nomor xxxx pin xaf info kantor pusat telkomsel,1
288,mudah aman bisnis togel kini bentuk online gabung raih untung di satu satu situs togel online percaya,1
289,yth bpkibu langgan tri sumargani dr operator tri plaza semanggi lt jl jend sudirman kav jkt pst kirim sms krn nmr sulit hubung hal ikut nmr dapat hadiah dr promo undi hadiah suzuki ertiga pin andatb info,1
290,putus resmi care selamat noanda pilih m dpt tabung rpjt pinmcxj info kelik,1
291,sempat jadi agen pulsa mkios all operator harga v v vrb vrb vrb vrb cara ketik daftar kirim,1
292,sempat jadi agen pulsaall operator mkios harga murah ketik gabung kirim,1
293,kirim bank bca no rek an andrianto djunaedi usaha hari trms,1
294,kirim mandiri aja an arya rek klo kabarin,1
295,kirim dulu pulsa ewu no mas agus,1
296,km bank bri sdh tlp tdk bs jd km sms nopin menang kghk m dpt hadiah untung bliung britama info klik,1
297,krim bni aja an ayu suryani no rek klo kirim kabarin,1
298,layan vip games rpsms xmgg sdh diperpanjangnikmati layan disinihttplivevipgamesmesid stop cs,1
299,ma belikan dulu besok pulsa rbu no baru penting,1
300,ma isi dl pulsa rb nmr,1
301,maaf sdah hubung tpi tdak sambung noanda resmi raih hadiah dari ptm kios pinmk uinfo hadiah klik mkiosblogspotcom,1
302,maaf sudah hubung tidak sambung no raih hadiah dr ptmkios pin mk cek pin di m kiosblogspotcom,1
303,maaf sudah hubung tidak sambung selamat noanda resmi raih hadiah dari ptcare pin bh uinfo klik blogspotcom,1
304,maaf sudah hubung tpi tdk tersmbung noanda resmi raih hadiah dri ptmkios pinmk cek pin di mkiosblogspotcom,1
305,maaf bu nur tanah tanjung api api sudah lihat sudah cocok masalah harga hubung suami aja pak hsulaiman di no hp xxxxxx betul ada acaratks,1
306,maaf soal angsur bulan bayar lalu bpkyogi hp soal sdh kuasa,1
307,maaf uang transfer ke bank xxx an xxx norek xxx bila transfer sms terima kasih,1
308,maaf iklan tawar pinjam uang tunai jamin kta jt sd jt dg ktp d kartu kredit bunga flat simpan sms ni ahub,1
309,maaf cuma ingat soal kontra kalau mau diteruskanbayar harap bpk chandra no soal sys dh kuasa sepenuh maaf cuma sms,1
310,maaf bu ratna meganai rumah sudah liat soal lagi bandara silah hubung suami h arif iskandarse hp trims,1
311,mahesian plz kna no nu rbu ayena,1
312,mamah pangmeserkeun heula pulsa as rbkana nomor ieu tong nelpon nuju riiweh ayeuna penting,1
313,manfaat fasilitas pinjam jamin syarat fcopy ktp kartu kredit proses hari kerja info hub rasti,1
314,manfaat segera creditcard utk apply pinjam jt cashback minat hub bintang tks,1
315,mau libur gratis lombok ajar foto klik httpgooglfvcnw paket internet rp dpt mbhr hub cek status paket,1
316,mau nissan jukeayo beli popmie skrg kirim kode kodeuniq siapa tahu kamu pemenangnyahati tipu cs klik httpgoogldmpk,1
317,mau uang tunai jtayo gabung layan video cliponyu keluar jurus gombal mu yg paling dahsyat utk host cantik cliponyu ketik clip cs,1
318,mega cell cari agen pulsa cip semua operator harga v v v rb minat ketik info kirim,1
319,mega prima tama promo discon blackberry dacota rp onyx rp iphonipad laptop camera info pin bb aea,1
320,meganai ruma bpkibu yg mau jual sd surpai sy minat sy tlpn tdk tembus masalah harga hub suami sy drhirawan,1
321,layan fasilitas pinjam dana tunai lalu jamin bpkb mobil cover area seluruh daerah indonesiabunga flat bulan no bi cheking proses cepat data lngsng jemput pihak survey kamibfi finance hub oktra mariadi sihaloho cp,1
322,lejit pintarkursus suami isteri aktifasi smangat bljr kuat fungsi iotak anak prestasi mningkattelepon ketik sms,1
323,kena rumah bpkibu yg mau jual sdh survey sy berminatsy telpon tdk tembus masalah hrg hub suami sy drhirawan,1
324,kena uang kontra kalau mau terusin harap bpk suyono nomor hp soal shd sya kuasa penuh dia maaf cuma sms,1
325,modal usaha solusi uang hanya copy ktp kartu kredit npwp no rek pribdi dapat jt dr bank hub lia,1
326,mohon maaf promosi pinjam uang tunai syarat copy kartu kredit bunga mulai bln gratis asuransi hub ani lia proses cepat,1
327,mudah kta baru pinjam sd jt bunga gratis asuransi copy ktp kartu kredit slip gaji hub mido,1
328,nagamas elecktronik bb dakota jt bb davis rb bb gemini rbq bb torch jt call sms pin bb a cellcom,1
329,nak ayah kirimin ayah uang rb no rek an yanti ayah lg kantor polisi ngurus surat tilang mks,1
330,kalau mau bayardi transfer harap hubung dulu atas bpk ardiansa no tlp soal ubah bayar trima kasih,1
331,kalau mau transfer tipon dulu no baru ini soal ubah no rekening terima kasih,1
332,nasabah bank bri yth selamat mndptkan cek tunai rpjt bank rakyat indonesia pin ijhk uinfo klik kunjung,1
333,nasabah bank bri yth no rek mdpt hadiah cek rp jt bri untung beliung britama pin ijhk info klik,1
334,nasabah bri yth dapat cek juta undi bri kode triplle cek info hadiah klik,1
335,nasabah bri yth norek pilih menang undi bri kode pin ijhk u info hadiah klik,1
336,nasabah yth di minta menghub bri prihal tabugan dapat cek rpjt dri bri dgn kode cek info klik,1
337,nasabah ythrekning tbungn error hrus monitor ulang bisa gunakn kmblimaaf sblum kntor hrap hub pk aryadhi dlu ditks,1
338,nasabah yth rek mndpt cek rpjt kode cek info hub klik,1
339,nasibberbagi bakti rutin ini ringan beban hidup dpt wallppr httpmminbizrwhum stop ketik unreg nasib cs,1
340,nasibnutrisi otak slh nya berfikir positif klo sdh segala bs jd ilmu dpt wallppr httpmminbizrjxpc stop ketik unreg nasib cs,1
341,nfo resmi nomor andaxxxxx pilih men dpt hadiah langsung pttri care pinpemenang fhjtl utkinfo lengkap klik,1
342,noid isi pulsa m tronil at dapat hadiah program poin isi ulang m tronik uinfo resmi menang klik,1
343,pangmeulikeun heula pulsa bpa simpati ribu we ganti ku bpa ieu nomor na nya,1
344,langgan yth simcard m dptkan cek tuanai rpjt pttricare indonesia pin hdrjn ucek pin kunjung blogspotcoid,1
345,langgan yth slmt kartu gsm men dpt tabung haji rpjt kopi jahe hut no pin efgr uinfo sgr hub laksana pt sidomuncul,1
346,langgan yth dapat hadiah dari poin plus plus indosat pin menang bch info menang klik webscom,1
347,langgan yth selamat men dpt hadiah dr undi pt indofood popmie pin fhx uinfo klik mie indofoodwebscom,1
348,langgan ythsaya mba muliani operator tri hubung tapi sambung jadi informasi saya sampai lewat sms hadiah jatuh tempo selamat nomor tri menang undi dr pesta isi ulang pulsapin menang bh segera hubung kantor tri jakarta tlp info klik,1
349,langgan ythsaya rezky operator tri hubung tapi sambung jadi informasi saya sampai lewat sms hadiah jatuh tempo selamat no tri menang undi dr pesta akhir tahun tri pin menang afr info klik triblogspotcom,1
350,langgan yth dri kantor tri jakarta sdh hubung no tpi tdk sambung informasi kami sampai lewat sms no trpilih menang hadiah cek rpjutadri undi isi ulanag tri pin undi andaafr uinfo klik,1
351,langgan yth simcard sbg menang dapat hadiah mobil toyota all new yaris pinjf gebyar undi care info lenkap klik careblogspotcom,1
352,langgan yth simcard sbg menang mendptkan hadiah mobil toyota all new yaris pinjf gebyar undi care info lenkap klik,1
353,langgan yth simcard sbg menang mendptkan hadiah mobil toyota all new yaris pinjf gebyar undi care info lenkap klik,1
354,langgan yth simcard sbg menang mendptkan hadiah mobil toyota all new yaris pinjf program pesta akhir tahun care info lenkap klik,1
355,langgan yth tri care noxv pin menang jf dapat hadiah unit mobil toyota yaris info klik httptri webnodecom cocok pin menang,1
356,langgan ythm kios cell tawar daftar cip m kios token pln harga pulsa v rp v utk gabung ketik info kirim,1
357,langgan yth selamat nosimcard xxx resmi menang undi poin plus plus edisi th pin andaerd uinfo klik poinblogspotcom,1
358,bayar sudah jatuh tempo silah melaporm hub kantor terima kasih,1
359,bayar nya bulan kalau mau bayar harap telponsms dulu atas bpkdedy hpterima kasih,1
360,tawar batas software sms gateway utk iklan sms pilkada sekolah instansi kampus harga promo rp hubjasa advertising corp jam,1
361,setor angsur nya kalau mau bayar harap tlp dlu atas sy bpk iwan hp dri indomobil finance tks,1
362,minta akan segera proses keyword reg gita layan pt hypermind,1
363,pesan resmi care saya dapat undi tiga uang tunai juta indonesiablogspotcom,1
364,pesan resmi m kios pesta isi ulang krt pilih men dptkan hadiah cek jt pinmhr hubcustumer klik edblogspotcom,1
365,pesan resmi ptplanet card dapat hadiah cek tunai nila rpjt jatuh menang kode pinbg silah cek careblogspotcom,1
366,pesan resmi pttri care indonesia selamat simcard dapat hadiah nila juta jatuh menang lv kode pin ijhk silah cek tricarecom,1
367,pesan resmi ptcare berkat isi ulang pulsa no resmi dapat hadiahrp juta care pin menang bh uinfo klik,1
368,pesan resmi tricare selamat mndpt hadiah unt mobil honda jazz rsnopin menang bl info kunjung httpgebyar carejimdocom,1
369,pesan resmi dr pttricare slamat no tpilih mndpt hadiah unit mobil honda jazz pin pmenang lm u info klik tricaretbkjimdocom,1
370,pesan resmi dr tri care indonesia selamat noanda mendpatkn hadiah dgn nopinbl uinfo silah kunjung jimdocom,1
371,pesan resmi dr tri care indonesia selamat noanda mendptkn hadiah dgn nopin pemenangbl uimfo silah kunjung,1
372,pesan resmi dri tri care slmt mdpt hadiah unit mobil honda jazz rs nopin menang bl utk info kunjung jimdocom,1
373,pesan resmi dri tri care selamat m dptkan hadiah cek tunai besar rpjt pin undi ad uinfo kunjung bimatriblogspotcom,1
374,pesan resmi dri tri careselamat m dptkan hadiah cek tunai besar rpjt nopin undi ad uinfo kunjung bimatricarejimdocom,1
375,pesan resmi m kios sim card menang hadiah cek jt promo m kios pinmhr hubirhsurianto klik mkiosjktblogspotcom,1
376,pesan resmi ptcare indonesia berkat isi ulang no m dptkan hadiah dengan kode pin bh uinfo hadiah klik ptcareblogspotcom,1
377,pesan resmi ptcare indonesia berkat isi ulang no resmi raih hadiah dengan kode pin jf uinfo hadiahlik isiulangcareblogspotcom,1
378,pesan resmi ptcare indonesia ucap slmt nosimcard resmi raih hadiah dengan pin bh uinfo hadiah klik hadiahblogspotcom,1
379,pesan resmi selamat no simcard m dptkam hadiah cekrpjuta dr tri care pinyrkz info keik tricareblogspotcom,1
380,pesan resmi selamat no simcard m dptkan hadiah cek rpjuta dr tri care pin yrkz info kelik,1
381,pesan resmi selamat no simcard m dptkan hadiah cek rpjuta dr tri care pin yrkz info kelik,1
382,pesan resmi selamat no simcard m dptkan hadiah cek rpjuta dr tri care pin yrkz info klik,1
383,pesan resmi selamat no simcard m dptkan hadiah cek rpjuta dr tri care pin yrkz info klik,1
384,pesan resmi tri no xv pin menang ytg pilih menang ii hadiah cek tunai jt info lengkap tri klik infowebnodecom nomer terus sms maafsaya mau telepon dari no,1
385,pesta m tronik bagai langgan setia m tronik pilih sbgi menang pin menang er uinfo klik,1
386,pesta m tronik bagai langgan setia m tronik pilih menang hadiah pin pemenangaiue uinfo klik undianmtronikjimdocom,1
387,pinjam sd miliard jamin bpkb mobiltruck min th bunga syarat mudah proseshari pt bunas finance tbk cover all wilayah andi,1
388,plenetcell cari agen ujual pulsa all operator harga pulsa p p prb info ketikinfo kirim atau hhb cs,1
389,plg yth nosimcard men dptkan unit toyota all new yaris gebyar tricarepin pmnang jf uinfo hub klik tricarejimdocom,1
390,plg yth no pilih menang cek rpjt dr pttelkomsel hut telkomsel thn hub call center,1
391,plg yth no xx m dpt hadiah all new avanza dr pttelkomsel pin andabch info klik resmijimdocomahub,1
392,plg yth selamat nomor care pilih mendptkan hadiah cek tunai rpjt dr program undi care pinca info klik,1
393,plg ythno men dpt hadiah dr pengundiang pt indosat pin andabch umelihat hadiah klik poinwebscom,1
394,plg yth simcard mendptkan bonus poin plus plus drptindosat pin andafg uinfo klik blogspotcom hub,1
395,plgyth nomor resmi pilih menang hadiah dari ptm tronik no pin gf uinfo urus hadiah klik,1
396,plgn yth mendpt hadiah unit mobil suzuki ertiga pthm sampoerna tbk pin andafah uinfo klik,1
397,plgn ythsaya hrian harino opoerator tri tlah hubung tapi sambung jdi informasi saya sampai lwt smssblum hadiah jatuh temposelamat no tri menang undi care no pin menang mgksegera hub kantor tri jakarta info klik,1
398,plgn ythtri mnctv umum nomor pada tgl maret pagi tdk sambung jadi desi hermawati costumer servis tri plaza semanggi lt jljend sudirman kav jkt pst kirim sms penting jatuh tempo nomor simcard tri menang undi pesta internet tri hadiah toyota new yarispin andadidinfo resmi klik trijimdocom,1
399,plgn ythtri mnctv umum nomor pd tgl agustus tdk dpt trsmbung jadi desy hermawati dr pthutchison tri plaza semanggi lt jljend sudirman kav jkt pst kirim sms sblum jtuh tempo bhwa no simcard menang undi pesta poin tri hadiah toyota all new yaris pin did klik situs resmi trijimdocom,1
400,pnjaman mudah tnpa jamin proses sangat cepat syrt ft cpy ktp krtu kredit bila minat call ari,1
401,promo blackberry bb dakota jt bb torch jt bb davis jt bb onyx jt bb gemini rb minat hub promo batas,1
402,promo blackberry bb dakota jt bb torch jt bb davis jt bb orlando jt bb gemini rb minat hub promo batas,1
403,promo cuci gudang blackberry samsung apple laptop beli dpt info call pin bb fb caturgadget ymailcom,1
404,promo lebaranpaket service motorolie rbharga biasa rprbada genuine oilgop shopinfo laku jui aug,1
405,promo baru toko artha jaya bb dakota jt iphone jt bb onyx jt camera call sms,1
406,pt m tronik hubung namun tdk sambung no resmi raih hadiah pin er cek hadiah di tk,1
407,pt garsindo cari agen jual pulsa m kios all operator transaksi jam dgn harga v v v ugabung kirim,1
408,pt indofood tbk sampai anda pilih menang hadiah dari promo popmie pinaiue utk info klik popmiejimdocom,1
409,pt pertamina persero terima karyawani lulus smk ddds s kirim lamarancvijazahphotox notip email pertaminareckrutment ymailcom,1
410,ptbni persero tbk rekening pilih rpjt rejeki bni taplus kode cek silah klik,1
411,ptindofoodtbk sampai anda resmi menang uang rpjt pop mie nopin xyqd info lengkap klik tbkjimdocom,1
412,ptmtronik berkah isi ulang pulsa mtronik no m dptkan hadiah dengan pin pemenanger uinfo klik,1
413,pttri care pin menang m dptkan hadiah i unit toyota yaris uinfo cek pin klik,1
414,pttri care selamat simcard dapat hadiah unit toyota avanza pin fhjtl info klik tricareblogspotcoid,1
415,pttri nov slamat nosimcard mraih cek tunai rpjt program isi ulang pulsa pinmcxj info klik,1
416,resmi indosat no xxxxxxx pilih menang poin plus plus pin menang bch uinfo klik poinplusplus webscom sms kirim no,1
417,resmi tri care pin menang jf medptkan unit toyota yaris uinfo lanjut klik cs,1
418,rumah tanah yg mau jualsy ibu ayu sdh survei minat umembeli mslh hrg mhn hub suami drhjsopian,1
419,arum k prasodjo operator tri jkt pst kerja sama ptpos persero buat surat pemberitahuan alamat registrasi kartu tri tidak temu jadi kirim lewat sms info iniselamatnomor menang undi tri siar di mnctv tgl agustus menang dengan pin undianmlengkapi prosedur hadiah anda belum jatuh tempo klikhttp trichampionsjimdocom,1
420,td pagi dapat sms pttrisimcard resmi m dptkan hadiah honda jazz rs kode pinbfgs info hub klik triblogspotcom,1
421,sayang belikn aq pulsa nmr nanti aq yg telp km aq pake hp tmn skrg yacc,1
422,sayang sekali kamu kalah cepat jangan khawatir ayo coba di sesi ikut pasti kamu baca pesan line indonesia dapat info kena waktu hadiah event sesi ikut,1
423,bayar di transfer harap hubung dulu atas sayabpk ardiansah no tlp soal ubah bayar,1
424,segera dapat e tiket pswt hrga promo terbang domestik internasional reservasi tiket mudah praktis hub travelcom,1
425,segera dptkan ijazah d s s asli daftar akreditasi cepat kilat instan resmi silah atau hubtks,1
426,selamat mndptkan cek tunai rpjt dr ptbank rakyat indonesia pin andaijhk uinfo klik untungbeliungblogspotcom hub,1
427,selamat menang undi pop mie dapat hadiah unit mobil nissan juke pin andabch info klik situs di undi pop miewebscom,1
428,selamat bagai menang promo undi pop mie getlucky men dptkan unit mobil nissan juke pin andabch uinfo klik pop mie webscom,1
429,selamat telah daftar member m pulsa kode agen d pin saldo rp tambah saldo ketik info kirim,1
430,selamat terdftr diprog gratis nelp mnt sms keisatinternet hg mb cuma dg isiulang mulai rb isiulang pulsa nikmat bonusnyacekbns,1
431,selamat kpd milik no simcard xxxxxx dapat uang tunai rp jt ptindosat pinrwd poin jimdocom hub spam,1
432,selamat nosim card m dptkan hadiah unit mobil toyota yaris pinjf uinfo hub klik hadiahtricareblogspotcoid awas tipu,1
433,selamat nomor care pilih mendptkan hadiah unit mobil toyota yaris pin menang andajf uinfo cek,1
434,selamat nomor care pilih mendptkan hadiah honda jazz rs dr program undi care pinrwf info klik nih bank bri no rekening atas nama bayu alamsyah,1
435,selamat no pilih m dptkan kejut hadiah langsung care kode menang bch utk info lenkap kunjung web,1
436,selamat mendpt hadiah rp juta telkomsel point edisi september hub kntr pusat ir dwi hartanto,1
437,selamat m hadiah satu unit mobil alphard dr telkomsel info hubkunjungi website di httptelkomselundianjimdocom,1
438,selamat men dpt hadiah rpjuta telkomselpoin periode maret pin andac hub kntr pusat irwardoyo,1
439,selamat mendpt hadiah rp juta telkomsel point edisi september hub kntr pusat,1
440,selamatanda m dptkan hadiah cek tunai rp jt indosat pin fg uinfo ambil hadiah kunjung website indosat indosatblogspotcom,1
441,selamatanda mdptkan satu unit mobil nissan juke dr ptindofood pin tdn uinfo ambil hadiah kunjung website luckyblogspotcom,1
442,selamatanda mndptkan hadiah cektunai rp jt indosat pin fg uinfo ambil hadiahkunjungi website indosat poinindosatblogspotcom,1
443,selamat menang unit mobil freed dr telkomsel edisi thn undi tdi mlm pkl rcti uinfo hub h mulyadi kirim,1
444,selamatanda m dptkan hadiah unit mobil honda jazz uang tunai jt rs dr pttricare pin menang andabfgs uinfo klik,1
445,selamatkepada langgan xxx mendpt hadiah dalam program poin plus plus indosat nopinfg info klik plus webscom,1
446,selamatno simcard resmi m dptkan hadiah unit honda jazz tri care pin menang ztkm uinfo cek pin klik,1
447,selamat t rpilih l ngsung m ndptkan hadiah dr pttelkomsel rpjtuinfo hubung pusat drshmulyadi pelaksanatelkomsel,1
448,seminar denpasar bal wakil mahasiswa kewirausahaan biaya transport rp juta nomor serta semnasdikti direktur mahasiswa dikti prof dr joko purwanto msi hubung wahyudin zarkasi no referensi ptx,1
449,sim card m dptkan hadiah yunit mobil toyota yaris nopin menang jf uinfo,1
450,simcard adalah menang gebyar isi ulang tri pinnf laku verifikasi sekarang hanya,1
451,slmat no m dpt dana bantu rpjt dr pt sidomuncul uinfo hubirhjmuliyadi pelaksanapt sidomuncul,1
452,slmt no mendptkan hadiah unit mobil honda jazz dr promo tri care dgn pin pemenanglm lnfo klik,1
453,slmt no resmi mdpt hdiah rpjt dri pt mkios pmenang pin andam uinfohubpakh risal dermawan mkios,1
454,slmt simcard xxxxxx mdpat cek tunai rpjt pin rwd info cs kunjung idjimdocom,1
455,slmt no men dpt hadiah drpengundian pttelkomsel no pin bc lihat hadiah sila klik,1
456,slmt no mendpt hadiah rp juta telkomsel poin undi tadi mlm pukul wib rctiinfo hub ir serianto kirim,1
457,slmt no men dptkan hadiah dr undi poin plus plus indosat no pindhi info menang silah klik indosatpoinpluspluswebscom,1
458,slmt no men dptkan hadiah dr undi poin plus plus indosat no pindhiutk info menang silah klik indosatpoinpluswebscom,1
459,kfc yg deket enhaii dy,0
460,maaf ada janji belum penuh ada janji ingat,0
461,ngsih bunga ato coklat min,0
462,sambl nunggu gimana kalo ngerjain form formnya aja dulu,0
463,akademik perhati tuk jadwal kontrak kuliah buat ang bukan sebenarny kuliah ikut jadwal kur yg baru ang ato atas jadwal yg adalah jadwal bayang tuk tuju kontrak kuliahhal atas ga laku tuk mk yg memang jalan ang kalian spt skripsi sidangdemikian harap perhati,0
464,info plaassalambagi yg ambil mk pla wajib kumpul haritgl kamis agustus pukul wibbagenda bekal jelas platempat gdg jica lt rsdemikian informasinyharap perhati d sebar,0
465,info teman yg kumpul data asisten labmatakuliah bukti upa surat terang bisa ambil pak andri,0
466,telah daftar langgan tcash full service tingkat saldo dg isi saldo tcash merchant logo tcash dekat,0
467,pin baru tcash adalah silah guna pin baru untuk nikmat layan tcash telkomsel,0
468,nya mad aku bingung bkn lapor,0
469,aamiin makasih semua moga cepat lulus,0
470,aamiin makasih semuanyasemoga teman cepat nyusul moga segala urus beri lancar allahaamiin,0
471,abis maghrib yaa,0
472,belakang warkop deket indomaret gum bulan,0
473,di bip studio foto gitu,0
474,nama tpi gatau msh fungsi engga udh lama ga dipake sih,0
475,ruang nya tadi,0
476,internet min alamat dmn,0
477,mba harga jtbln fasilitas air hangat kamar mandi tv tv kabel wifi meja tempat tdr lemari,0
478,nya instagram,0
479,asa nyesel gt sedikit waktu kuliah asa ga merhatin ga ngerangkul semua aku pribadi hmm,0
480,semua pandu pladishare grup dan fb,0
481,sih yg nikah muda tp liat bahagia tp one of a million kayak kalo temen ku hmm,0
482,teh dikpad kontak,0
483,rb kamar mandi sama kalau ada kamar mandi dalam kalau yang kecil yang besar rb,0
484,yg kok ikan tahu tempe,0
485,yg nikah muda yg gagal nikah yg pacar lama eh putus alesannya karna terlalu sayang jd gak mau nyakitin pret yg jagain jodoh org yg ah banyak lah wkwk,0
