,Teks,label
0,promo beli paket flash mulai gb my telkomsel app dpt extra kuota gb g lte extra nelpon hingga mnthr buru cek tselmemytsel s k,2
1,gb hari rp ribu spesial buat yang pilih aktif sekarang di promo sd nov buru aktif sekarang s k,2
2,plg yth sisa kuota flash kb download mytelkomsel apps httptselmetsel utk cek kuota beli paket flash hub,2
3,plg yth sisa kuota flash kb download mytelkomsel apps httptselmetsel utk cek kuota beli paket flash hub,2
4,gb hari rp ribu spesial buat yang pilih aktif sekarang di buru skb,2
5,hari ekstra pulsa rb dg beli paket internet bulan mytelkomsel utk beli pertama sjk aug sept cek detail promo tselmemytsel,2
6,iring dgn tarif rp hr panjang rp hr hits armada curi hati tekan lalu okcall info,2
7,akhir bulan tetap eks loh internetan pake volume ultima mbhr hrga mulai rp rb tarif lokasi cek tselmefl,2
8,aktif iring coboy jr hebat tekan info hits baru noah engkau aktif iring nya hp kamu ketik mg noah kirim info berkah iring rp dr yuni shara akhir aktif iring nya tkn lalu okcall raih thr puluhanjt henti unreg,2
9,ambil bonus hari bebas pulsa dptkan gratis nelpon internetan promo lain sesuai hobi,2
10,akan henti langgan paket flash ketik flash spasi ya tuju tunggu sms konfirmasi nonaktif paket,2
11,akan langgan paket rp utk mb gg mb ghari tuju balas flash spasi ya kirim utk lanjut paket panjang akhir masa aktif tarif sesuai lokasi tunggu sms konfirmasi sblm pakai info zona detail tarif lihat tselmeinternet,2
12,akan beli paket gampang internetan rp utk chatting puas bbm whatsapp line harijika tuju balas flash spasi ya kirim utk melanjutkantunggu sms konfirmasi sblm pemakaianinfo detail tariff lihat tselmeinternet,2
13,akan terima setting ponsel ponsel dapat akses internet kirim fotomms anda tuju balas pesan gratis ketik y,2
14,akan aktif paket bbm gratis laku hari pertama kali aktivasi ketik flash spasi untuk lanjut,2
15,dapat kupon program kartu as biber beli internet hadiah cek total kupon maksimal x jam skrg info lengkap hub,2
16,sedang nikmat paket reguler dgn sisa kuota kbdapatkan agam paket internet hemat tri,2
17,tidak daftar layan paket malam hari langgan laku isi ulang voucher kenyang download,2
18,tlh tukar poin poin tukar terus poin siapa tahu menang hadih lg g gb menang yang tukar poin tinggi sd november,2
19,angpaopoinsenyum dptkan vchr lottemart rb dg tukar poin normal poin sd feb ketik batas info,2
20,awal bulan nya eks lebih lama internetan pake volume ultima mbhr hrga mulai rp rb tarif lokasi cek tselmefl,2
21,ayam sayappaha bawah nasi perkedel rp gratis teh pucuk tukar sms di cfc hasan sadikin hari lama sedia msh promo,2
22,ayo anak medan beli sticker line pulsa cara klik http nama stickernya dan medan,2
23,ayo download axisnet appleplay store aktif bronetjam gb hr rp bronetjam gb hr obor gb rp info ld,2
24,ayo download axisnet playapple store aktif bronetjam gb hr rp bronetjam gb hr obor gb rp info ld,2
25,ayo dukung lestari alam indonesia sama indosat ooredoo indonesia dg donasi lalu nomor indosat ooredoo,2
26,ayo kawal manfaat subsidi bbm kompensasi yang hak adu ketik bbm spasi isi pesan kirim,2
27,banting harga internetan dgn kuota gb rb rupiah paket laku bulan mau ketik ke sd desember,2
28,bebas ekspresi diri sama paket freedom combo indosat ooredoo segera hub,2
29,bebas pulsa ambil bonus gratis dptkan gratis nelpon internetas promo lain sesuai hobi,2
30,beli gratis lychee tea latte flavour yellow truck jlpatuha no tukar sms hanya laku hari s k berlakupromo,2
31,beli gratis beli diskon tiket kampung gajah wonderland bandung sd mei tunjuk sms kpd tugas info,2
32,beli gratis donut dunkin donuts borma setiabudhi tukar sms segera laku hari lama sedia ada promo,2
33,beli paket turbo mulai rb utk beli pertama mytelkomsel app sjk aug sept dpt extra pulsa tsel rp rb loh cek detail paket tselmemytsel,2
34,internetan gb cuma rb paket laku hari mau ketik ke tawar laku sd januari,2
35,bonus kuota mb hr cukup isi ulang min hari ayo buru isi pulsa sekarang t,2
36,bonus pulsa rb ayo isi pulsa min rb dapetkan bonus pulsa rb utk nelp nmr tri hari saja ayo buru isi pulsa t,2
37,bonus pulsa indosat ooredoo mau ketik call hp kamu april,2
38,bonus pulsa rb cuma dgn isi ulang rb hny indosat yg begini tawar laku sd april bonus x utk guna sama indosat ooredoo,2
39,bonus pulsa rp rb spesial kamu langgan setia indosat ooredohanya isi ulang rprb skrg tawar laku sd jan bonus x,2
40,bonus rp kamu cukup kirim sms x hari untuk dapat bonus khusus hari saja t,2
41,bonus rp kamu cukup telpon teman kamu lama menit hari untuk dapat bonus khusus hari saja a,2
42,bukti hemat pakai argo tetap bandung grabcar hingga hayu aja rencang sareng buktikeun nyalira,2
43,buru download registrasi mycare httpbitlymycareply dapat promo gb g paket freedoom m l harga khusus hari,2
44,butuh piknikada nih libur gratis hongkongcarapake pulsa axis hp androidmu buat transaksi banyak items pokemon gobigococ dllinfo ld,2
45,buy get tiket trans studio bandungmulai mei juni tunjuk sms tugas lokasi info,2
46,cuma rp nelpon sms unlimited sama indosat ooredoo internetan puas hari paket ramadhan unlimited ketik,2
47,dapat bonus pulsa hg rb isi ulang hari minggu isi ulang mulai dr rb ktk gratis krm pandu ketik pan krm cek bonus tekan,2
48,dapat bonus sms kamu dg kirim sms kamu dapat bonus ratus sms semua operator pakai terus indosat ooredoo raih bebas komunikasi,2
49,dapat disc mcdonalds khusus utk bayar dgn tcash tapdptkan stiker tcash tap grapari dekat info tselmetappromo,2
50,dapat disc utk dominos pan pizzaroti yg lebih tebal dgn keju asa pinggirmulai rpkunjungi toko terdekattelf klik panpizzacoid,2
51,dapat extra kuota gb g lte extra nelpon hingga mnthr dg beli paket flash mulai gb my telkomsel app buru cek tselmemytsel s k,2
52,dapat gratis cappuccino hotice freza transaksi min rprb excelso cafe semarang yogya solo sd agust tunjuk sms kpd tugas,2
53,dapat gratis wendy s crispy chicken sandwich minimal beli rp tukar sms di wendy s dekat sedia batas promo,2
54,dapat saldo main besar rp rb dengan bayar rp rb laku hari senin kamis tukar sms segera timezone dekat promo,2
55,dapat voucher cipika rp rb utk belanja kuliner gadget fashion tkn pilih cipika gratis batas info,2
56,dear customer kindly values your experience at telkomsel service score between very poor to excellent send sms to free for int l charged,2
57,disc domino s pizza value range sd agustuskunjungi store terdekathubungi visit httpbitlykoz kodevrd,2
58,diskon ribu khusus langgan baru grab bandung laku x kode promo urangbandung tak usah repot jalan macet susah parkir hayu ngegrab we atuh,2
59,diskon kuota nelpon menit smua operator cuma rprb normal rprb dg masa aktif panjang balas sms dgn ketik tri hari v,2
60,diskon utk kacamata lengkap bonus kacamata hitam tunjuk sms di jl gatot soebroto t s ampk berlakupromo,2
61,domino s pan pizzarotinya lebih tebal dgn keju asa pinggir nikmat disc mulai rpkunjungi toko terdekattelf klik panpizzacoid,2
62,double kuota internet plus unlimited telpon sms paket freedom combo indosat ooredoo segera hub,2
63,download rasa seru game game premium pilih di,2
64,dptkn free member card larissa aesthetic center disc high treatment asuransi jiwa tiap isi ulang pulsa rp rb galeri indosat jateng diy sd des,2
65,dptkn sempat raih hadiah utama mobil alphard dg cara tukar poin senyum dg kupon undi sd tgl junketik undi jmlh poin rp,2
66,dukung rehabilitasi kembang potensi anak butuh khusus ypac jakarta bagi lalu sms donasi etik,2
67,flash promo sd agt ayo datang gallery smartfren dekat diskon rb dg tukar hp smartfrenmu andromax g lte utk tukar dg mifi g lte,2
68,free doublescoop ice cream disc haagen dasz tcash tap s k laku info tselmetappromo,2
69,gratis gb yg blm ganti kartu sim jadi sim g tukar skrg gerai indosatooredoo dekat nikmat gratis gb jaring g,2
70,gratis nelpon saja semua operator cukup beli internet hari mb harga rp balas sms dgn ketik js utk beli n,2
71,gratis whatsapp hari cukup beli internet hari mb harga rp balas sms dgn ketik jr utk beli n,2
72,guna grab nikmat diskon x guna baru masuk kode cobagrabcar sekarang dan ajak teman teman keliling bandung tanp,2
73,guna grabcar grabtaxi dapat diskon ribu dan stasiunbandara bandung masuk kode promo grabtravel hingga pakai september hatur nuhun,2
74,guna tcash bayar tagih listrik beli token listrik cukup hubung pilih menu bayar beli,2
75,hai apa kabar bonus riah cukup isi pulsa minimun rp ribu sd november kamu langsung dapat mb gratis ayo isi pulsa bonus utk hari rla,2
76,hallo bro beli koin games pakai pulsa yuk mudah banget loh sob cek httptselmejajanonline,2
77,hallo urang mang ado sticker rancak group line urang kampuang mang guy beli pake pulsa telkomsel,2
78,hari freedom combo xl cuma rp rb normal rp rb gb music streaming gak pake kuota unlimited nelp sms daftar,2
79,hari cuma ribu kamu langsung mb hari cukup balas sms dengan ketik buru beli sekrang tlb,2
80,hari freedom combo xl rprb normal rprb double kuota gbgbg promo gbg unlimited nelp sms indosat ooredoo ketik freedom xl,2
81,hari bronet jam gb hr rp bronetspecial gb hr gb jamgb rp segera aktif paket sekarang info ld,2
82,hari bronet special gb gb jamgb hr rp bronet jam gb hr rp ayo segera aktif paket kamu info ld,2
83,hari rabu saat blanja blanjacom nikmat diskon spesial transaksi tcash s k laku klik bljcotcashrabu,2
84,hari senin saat nonton hemat ribu cema xxi dgn tcash tap dptkan stiker tcash tap grapari dekat info tselmetappromo,2
85,hari akhir kunjung galeri smartfren skrng buat kamu andromax a g jd rb nrml rb tunggu apa lagistok terbatassd agts kinfodlj,2
86,hayu dateng mumpung ustad fatih karimbeliau yg islam ustad felix siaw,2
87,hi ayo coba grab mesan taxi cepat aman klik httpsinvitegrabcoaad,2
88,hot promo dptkan extra pulsa tsel rb dg beli paket internet pertama kali my telkomsel app sjk agsts sept cek detail paket tselmemytsel,2
89,hot promo internetan kuota gbhr rp ribu aja beli promo sd juni s k,2
90,i m spreading the go jek love download the go jek app at httpgo jekcomapp and input this referral code to get rp free credit to your first booking gojekgotmehere,2
91,ikut jobfairactive ujiklyakankerjaberstifikat plasatelkommlg feb dptkan platihan intrview rekom kerja ribu ph info,2
92,internetan puas kapan aja buat kamu butuh kuota besar paket sumo gb hari semua jaring beli info d,2
93,isi saldo tcashmu lalu jaring atm sama atm bca laku transfer antar bank pilih bank tcash kode bank guna no hp sbg no rekening tuju,2
94,isi ulang kuota gb hasil kuota tlh tambah nikmat bonus nelpon semua tri rprb cek bonus atau bimatri,2
95,isi ulang rp hasil kode transaksi cek promo rabu rawit jumat baik buat semua langgan axis,2
96,jalan ibadah haji dg nyaman tnpa prlu ganti kartu lokalnikmati gratis menithr trima telp dr indosatooredoo internet unlimited rprbhariinfo pai,2
97,jangan kejar diskon lari beli rawit diskon datang sendiriayo isi ulang kartu axis kamu sekarangdan pasti besok ikut promo rabu rawitinfold,2
98,jangan lupa kirim sms sd juni utk mendptkan gratis sms sesame indosat lama hr laku x lama periode prog info us,2
99,jangan kalah bro games mu bantu tambah koin beli aja pakai pulsa cek cara httptselmejajanonline,2
100,jangan habis hari di baskin robbins value scoop cuma lho tunjuk sms s k laku promo,2
101,jumat baik promo bronet jam gb hr rp bronet gb hr jam gb gb rp segera aktif paket lalu infold,2
102,kapan lg beli paket flash mulai gb mytelkomsel dpt extra pulsa rp rb utk beli pertama sjk aug sept cek detail paket tselmemytsel,2
103,kamu langgan setia kamu tukar hp smartfrenmu dg andromax e g lte hny rbnrml rb segera galeri smartfren,2
104,kartu g lte telah aktif dapat kuota tambah sd gb konten tarik jaring g hub info lokasi,2
105,sempat langka cuma buat kamu loh dapat gb cuma rp balas sms dengan ketik y sd november bonus laku hari tld,2
106,ketik flash spasi info kirim utk status paket kamu loopers dptkan info tren anak muda challenge beli paket loopcoid follow loop id,2
107,ketik sd maret cuma rprb per bln lgs dptkan gbgbonus gbg utk internetan telp sms puas ke semua nomor,2
108,khusus buat kamu yg doyan internetan cukup rb k bs internetan slm minggu kuota gb buru ketik oke pnwrn sd khusus nomor,2
109,khusus buat kamu paket internet ribu dgn kuota gb lama hr laku jam jaring cepat indosat balas sms ketik ke sd mei,2
110,kocak abis mau liat aksi pemuda galau iseng gokil kepung polisi super cantik tonton aja comic via hp kamu cmn hr ketik film,2
111,koin tinggal dikit lanjutin gamesmu beli pakai pulsa aja bro cek httptselmejajanonline,2
112,kuota internet habis segera isi kuota di akses aplikasi bimatri gadget info,2
113,lebih hemat langgan paket data minggu cuma rp cara gampang kok cukup ketik kuotaspasik krm sms,2
114,lebih hemat langgan paket internet minggu dgn kuota mb cuma rp cara gampang cukup ketik kuota spasi k,2
115,line lets get rich makin seru tambah koin pulsa mudah banget cara google play,2
116,loopers pakettelkomselflash rp utk mb tambah mb g gb laku hari tlh aktif paket otomatis panjang pd akhir masa aktif kamu langgan paket,2
117,maaf kamu milik bonus kuota dapat bonus kuota hingga gb toko dekat laku jawa timur bal lombok,2
118,main terus games mu sekarang beli koin pakai pulsa cek cara httptselmejajanonline,2
119,main terus gamesmu beli banyak appsin apps google play store,2
120,ingat warkop dki dapat nsp nya gratis akses dan dapat promo gratis lain sesuai hobi,2
121,mau bonus keren indosat ooredoo ketik hp kamu sekarang,2
122,mau bonus pulsa indosat ooredoo ketik call hp kamu mei,2
123,mau cepat ga mau ribet cek pulsa sisa kuota internetmu yuk download aplikasi mycare sekarang atau akses httpsmycareindosatooredoocom,2
124,mau cepat gift paketextra kuota internet ga mau ribet isi ulang pulsa download aja aplikasi mycare smuanya jadi mudah install httpbitlymycareply,2
125,mau download file besar putus tinggal hari gatis mifimodem g spesial untuk bawa sms ke galeri sf isi pulsa rb sana sd jan dl,2
126,mau ekstra telpon sms internetan s k laku ikut surveu singkat aplikasi musik sd september klik httptselmemulu,2
127,mau internetan kuota besar harga murah buru cek tawar khusus nomor kamu cuma laku juli,2
128,mau jajan gak usah mana sob jajan online aja utama buat kamu suka nge games cek httptselmejajanonline,2
129,mau paket data gb buat bulan cuma ribu buru ketik mau tawar hanya laku sd jul,2
130,mau paket data cuma ribu buru cek tawar hanya laku juli,2
131,mau pergi hati nya aliando hp kamu ambil nsp gratis nya akses dan dapat promo gratis lain sesuai hobi,2
132,merdeka hot sale kuota gb harirprb cuma rprb tawar batas cek sekarang d,2
133,migrasi kartu ke kartuhalo nomor tetap sama dapat paket spesial gb rbbulan kunjung grapari tunjuk sms inipromo terbatasskb,2
134,murah seru banget main gamesmu pakai pulsa aja beli koin cek cara httptselmejajanonline,2
135,murah rprb dptkan gb paket internetan utk hr kini internetan jadi makin seru aktif segera promo sd feb,2
136,naik lebih sering hemat lebih banyak sama grab cukup laku jalan biasa grabcar grabtaxi kamu otomatis dapat diskon jalan ikut nikmat diskon tahap hinga ributrip ayo coba bukti,2
137,nasabah yth rekening btpn wow sudah aktif laku transaksi lalu guna pin rahasia info hub,2
138,nelpon murah rp panggil mal sin thailand hk china usa dgn tekan kode negarano tuju info,2
139,nikmat combo wendy s fried chicken nasi minum rp periode juni tukar sms di wendy s dekat sedia terbataspromo,2
140,nikmat disc utk dominos pizza premium big party weekendharga mulai rprbberlaku dine intake away sd may kunjung store terdekathubungi,2
141,nikmat discount bakmi gm hari hny dgn tcash tap s k laku info tselmetappromo,2
142,nikmat diskon tarif sli semua negara mulai pukul sd wib sd agustus info lengkap ketik,2
143,nikmat diskon tarif indosat hingga negara chn mlahkgsngtwnvtmmacau laku feb info hub ok,2
144,nikmat double internetan jaring data kuat gb gb g tlp sms puas dgn pkt freedom combo daftar httpmycareindosatooredoocom,2
145,nikmat double kuota promo gbg jaring data kuat unlimited nelp sms jam dgn pkt freedom combo tekan indosatooredoocomfreedom,2
146,nikmat ekstra pulsa dgn isi ulang min rb aplikasi mytelkomsel guna t cash download di httptselme promo sd agst,2
147,nikmat ekstra pulsa dgn isi ulang min rb aplikasi mytelkomsel guna kartu kredit visa download di httptselme promo sd agst,2
148,nikmat extra gb g lte extra kuota hingga gb midnight dg beli pkt flash gbhr mulai rp rb cek tarif tselmefl skb,2
149,nikmat extra gb g lte extra voucher belanja hingga rb dg beli pkt flash gbhr mulai rp rb cek tarif tselmefl skb,2
150,nikmat indosat super g utk internetan ckp rbminggu dpt kuota mbmbbonus mb jam cepat hggmbpstekan syarat laku hub,2
151,nikmat mudah bayar iur bpjs dgn tcash cukup hubung pilih menu bayar guna app t wallet smartphone android iphone,2
152,nikmat nelpon sms unlimited sama indosat ooredoo internetan puas hari paket freedom mini ketik,2
153,nikmat nelpon sms unlimited sama indosat ooredoo internetan puas hari paket ramadhan unlimited ketik,2
154,nomor telah isi nomor sn,2
155,nomor kamu milik paket netmax dapat paket netmax gb gb lalu hape aplikasi bimatri website tricoid,2
156,nomor memang paling untung tes identitas sedia untuk menang pulsa rprb tes kirim sms y sekarang info vd,2
157,pakai handphone xl axiata mu langsung internetan pakai xl,2
158,pakai xl tdk perlu repot setting langsung internetan yuk aktif paket internet myxlcoid sekarang,2
159,paket gb hasil aktif restart hape kamu utk dpt nikmat kuota internetan lama hari cek sisa kuota,2
160,paket sudah non aktif atas minta guna internet akan kena tariff dasar internet sesuai skema tariff kartu hubung aktif paket internet lain info lebih lanjut,2
161,paket bronet jam mb hr aktif nikmat mb laku aktif sd promo axis lain telp info,2
162,paket bronet jam gb hr rp segera aktif temu tawar tarik axis lain telp info,2
163,paket bronet gb hr jam aktif nikmat internet gb laku hingga jam aktif sd promo axis lain telp info,2
164,paket flash mb utk hari akhir pd tarif non paket laku tgl tsb info hubung cek kuota,2
165,paket internet bronet jam gb hr kamu aktif otomatis panjang jam info,2
166,paket internet spesial buat kamu internetan lama minggu dgn kuota gb cuma rprb ayo segera ketik kebut kirim sd juli jgn lupa,2
167,paket super murah pcs c strip ayam sayapnasiteh pucuk rptukarkan sms di cfc yogya subang hari iniselama sedia adapromo,2
168,paket super ngebut gb hr rprb sudah aktif nikmat mb g di g panjang mar jam info,2
169,paket tsel flash akhir tgl panjang dg mb utk hari harga dpt ubah sesuai lokasi pasti pulsa cukup utk henti langgan ketik flash off info detail tariff lihat tselmeinternet,2
170,langgan yth update informasi tarif baru di tselmeas hubung rp call,2
171,beli dave s single burger gratis small fries minum periode september tukar sms di wendy s dekat tawar terbataspromo,2
172,tawar khusus bonus kuota mb hr cukup isi ulang min hari ayo buru isi pulsa sekarang t,2
173,tawar spesial obral paket data gb nelpon puas nmr indosat rprb utk minggudaftar skrg ketik ke laku hari rtx,2
174,plg ythmohon beri nilai puas alam layan telkomsel ketik utk bhs indonesia type for english send to free for int l charged,2
175,promo panjang gratis mifimodem g untuk tunjuk sms di galeri smartfren isi pulsa rb utk bawa pulang mifi favorit sdnov dlk,2
176,promo poin spesial tukar tselpoin kamu menit sms mb periode promo juli info hub,2
177,promo beli paket flash mulai gb my telkomsel app dpt extra nelpon hingga mnthr buru promo batas s k,2
178,promo beli paket flash mulai gb my telkomsel app dpt extra kuota gb g lte extra nelpon hingga mnthr buru cek tselmemytsel s k,2
179,promo beli paket flash mulai gb my telkomsel app dpt extra paket gb midnight buru promo batas s k,2
180,puas internetan chatting facebook nonton video lama hari hingga gb cuma rp ribu beli paket,2
181,quota gb harga mulai ribu beli paket puas internetan lama hari,2
182,raih smartphone diskon merchant free internet voice sms promo tahun ri tukar telkomsel poin mulai ags di mytelkomsel apps,2
183,rawit harga miring internetan makin sering ayo isi ulang kartu axis kamu sekarang pasti besok ikut promo rabu rawit info ld,2
184,rawit kuota bagus harga khusus ayo isi ulang kartu axis kamu sekarang pasti besok ikut promo rabu rawit info ld,2
185,ribet bolak balik cek pulsa cek sisa kuota internetmu download aja aplikasi mycare x klik semua jadi mudah akses httpsmycareindosatooredoocom,2
186,rprbbln utk bln hrg normal rprb utk bln dst nelpon sms puas im plus kuota gbggb gmau ketik ke sd juni,2
187,rprbbln utk bln hrg normal rprb utk bln dst nelpon sms puas im plus kuota gbgb g mau ketik ke sd aug,2
188,saat pindah jaring g cepat tukar kartu di gerai indosatooredoo jljend soedirman purwokerto dptkn bns rprb utk nelpsms indosatooredoo,2
189,segera aktivasi rekening btpn wow ketik tekan yes call lalu buat pin rahasia info lengkap hub,2
190,selamat dapat voucher berrybenka rprb masuk kode voucher twd transaksi mau voucher hub,2
191,anda masalah dgn cckt stres dgn bunga lunas disc sd hub aty wa legal,1
192,lelah byr min payment solusi bantu legal tutup cckta dscn hublolyta wa legal,1
193,dana tunai kta bunga hingga jt syarat ktp cc dgn bpkb rate hari cair hub ayu wamhn maaf bila menggangu,1
194,roxi cell dengan rprb bisa jadi agen pulsa elektrik semua operator gsmcdmavvutk daftar ketik mtronik kirim,1
195,ramadhan selamat menang rpjt pin code yrkz info ramadhanblogspotcom,1
196,brminat cash kredit mtor scond brg istmwa tipe merk apa sjdsini mnyediakn unit dr thn atas hub ms dediktp luar yk bs,1
197,mau menang togel tembus pasang shio tunggal angka ingat mahar pulsa rb kirim no xxx khusus putar sgp senin,1
198,punya pesan suara untuk dengar pesan suara silah tekan tekan okya bebas biaya terima kasih,1
199,pmain togel sring kalahmau hasil mbah joko bisah mbntu sioangka retuwal minat hub mbah jokodi jamin tembus,1
200,aneka shop bagi promo type blackberry dakota jt tourch jt onix jt gemini rb upemesanan pin bb ade,1
201,anyonghaseyo ngaku kpopers sejati ayo lengkap koleksi video kpopmu httpkpopxlcoid skrg harga video lebih murah loh info,1
202,artha cell diskon brg elektronik bb dakota juta bb onyx jt camera hub sms pin bb bddfd cellblogspotcom,1
203,ass kena rumah tanah yg kemarin sy sdah survei sy mrasa cocok nego harga hubung sms suami pak haji dermawan,1
204,ass sy randy kena mobil yg sdh sy liat kondisi y betul minat mohon hub bapa sy utk bicara hrg net drhdarmawan xxxxxxx,1
205,assmaaf sy wahyumengenai mobil bpk yg mau jual sy lihat cocok nego hrg silah hub saudara sy dgn pak jusman safei tp,1
206,ass maaf sy by hjsuri kemarin survey rumah kena harga hub suami h sigit tlp terima kasih,1
207,asssy sugiyono yg tempo hari mngenai mobil toyotanyasy brminatcocoktlong hub sodara sy dluuntuk negosiasi harga anabdullah hp,1
208,assalamu alaikumsaya reski dr costumer servis tri plaza semanggi lt jljend sudirman jkt pst sdh m hubung waktu undi laku noanda tdk sambung jd krimkn lwt sms jatuh tempo noanda menang undi dr tri jenis hadiah unit mobil suzuki ertiga newdengan pin dcs jadi silah cek lebih di website hub,1
209,assalamu alaiqum nenek masuk rumah sakit kirim dulu ulsa ribu nomor mau telpon di rumah sakit ganti uang,1
210,ayah isi pulsa xl rb no sekarang penting,1
211,bapak tukokno pulsa as ndisek ribu iki nmrku anyar cepet saiki tak entenipenteng bpk msalah kantor polisijangan dulu smstlp,1
212,belanja online promo disc bb dakota jt bb onyx jt bb z jt infosms pinbbaff klik olshopblogspotcom,1
213,belanja online toko resky discon bb laptop samsung ipad nokia upemesananorder callsms kunjung web di shopblogspotcom,1
214,belikan dulu mama pulsa simpati ribu nomor baru mama kalau kirim sekarang cepat penting hpnya orang mama pinjam,1
215,bella bingung bang mau nulis apa aq nulis panjang serba salah mending langsung ngobrol tlpn aja deh bang no telp aq xxxx,1
216,berkah poin nomor mndpt hadiah i pin dhi silah verifikasi pin menang situs resmi,1
217,berkat isi ulang pulsa no tpilih sbg menang cek tunai rpjt dri ptm kios pinnf uinfo klik mkiosblogspotcom,1
218,berkat isi ulang pulsa no pilih sbg menang kejut tri men dpt cek tunai jt dr planet care pinbh cek hadiah di careblogspotcom,1
219,big sale discound z jt iphone gb jt snote jt camera laptop pin bb ab callsms kunjung,1
220,big sale sinar blackberry z rpjt dakota rp jt tourch rp jt davis rp rb infohubsms ccfa bbblogspotcom,1
221,blackberry city jual blackberry discond dakota jt torch jt onyx jt davis jt gemini g jt uinfo hub ibuanita pin bbd,1
222,blackberry online big sal bb z rp jt dakota rp jt samsung note ii rp jt iphone gb rp jt laptopcamera minat invite to bbm pin affc,1
223,bpkibu kena rekening pilih menang cek jt dri bni uinfo klik kode cek hub,1
224,bpkibu yth milik noxxx pin undi resmi m dptkan rpjt cs klik carecom,1
225,bpr syariah yogya siap layan biaya usaha andasyaratcopy ktpkkbuku nikah cukup dg jamin bpkbsertipikatproses survey cepat hub,1
226,butuh dana tunai cepat juta dgn bunga rendah flatbln proses jamin hari syarat mudah info ibu yani,1
227,cahaya travel tiket murah promo terbang domestic internasional online booking jam hub kelik,1
228,casino online besar daftar diri raih bonus referral bonus cashback sportsbook minggu main smartphone pc,1
229,dapat e ticket promo terbang domestik internasional lalu via online mudah aman hub klick,1
230,dapat e tiket murah promo terbang domestic international booking online info hub traveljimdocom,1
231,dapat segera tiket murah promo ditravel kmiuntuk terbang domestik internasional online booking jam minat hub,1
232,dapat total hadiah ratus juta rupiah kota berkah cara klik program sd agustus,1
233,daptkn e tiket pesawat promo layan domestik and internasional booking online cepat aman hub link travelcom,1
234,de inih bapa pake no temen kirimin pulsa no inih soal penring banget di rumah digantiin,1
235,sini uang transfer rek bank xxx xxx an xxx kalau sms no xxx,1
236,transfer uang nya rekening bni an ismawati rek sms klo sdh kirim,1
237,jual ticket super junior tgl april lady gaga tgl juni harga goldjt tribunjt info hub lady ticketwebscom,1
